{
  "id": "module-vector-spaces",
  "course": "linear-algebra-foundations-to-applications",
  "order": 2,
  "title": {
    "ja": "ベクトル空間と部分空間",
    "en": "Vector Spaces and Subspaces"
  },
  "description": {
    "ja": "ベクトル空間と部分空間を、前提関係と学習活動に沿って構成する。",
    "en": "A coherent module on Vector Spaces and Subspaces."
  },
  "topics": [
    "vector spaces",
    "subspaces",
    "span",
    "column space",
    "row space",
    "null space",
    "independence",
    "basis",
    "coordinates",
    "dimension",
    "rank",
    "rank-nullity",
    "four fundamental subspaces"
  ],
  "units": [
    "vector-spaces",
    "subspaces",
    "linear-combination",
    "span",
    "linear-independence",
    "basis-definition",
    "dimension-and-rank",
    "coordinate-vectors"
  ],
  "exercise_ids": [
    "module-vector-spaces-exercise-basic",
    "module-vector-spaces-exercise-conceptual",
    "module-vector-spaces-exercise-synthesis"
  ],
  "purpose": {
    "ja": "ベクトル空間と部分空間を、前提関係と学習活動に沿って構成する。",
    "en": "A coherent module on Vector Spaces and Subspaces."
  },
  "entry_prerequisites": [
    "module-systems-matrices"
  ],
  "learning_objectives": [
    "vector-spacesの定義・例・基本計算を説明できる",
    "subspacesの定義・例・基本計算を説明できる",
    "linear-combinationの定義・例・基本計算を説明できる"
  ],
  "exit_competencies": [
    "vector spacesからfour fundamental subspacesまでの主要な関係を説明できる",
    "Module演習をbasic・standard・challengeの三役割で解ける"
  ],
  "adjacent_modules": {
    "previous": "module-systems-matrices",
    "next": "module-linear-transformations"
  }
}
